{
  "runtime": "runtime.node",
  "runtimeVersion": ">=20 <23",
  "project": "/home/example/project",
  "scope": "project",
  "harness": {
    "identifier": "https://example.org/h/example-owner/example-harness@1.0.0",
    "version": "1.0.0"
  },
  "files": [
    {
      "path": "skills/example-skill/SKILL.md",
      "action": "create"
    }
  ],
  "conflicts": [],
  "adaptations": [],
  "unsupportedCapabilities": [],
  "mcp": [],
  "hooks": [],
  "services": [],
  "environmentVariableNames": [],
  "risk": {
    "effectiveClass": "A",
    "autonomyLevel": 1
  },
  "snapshot": {
    "id": "snap-created-0001",
    "covers": ["skills/example-skill/SKILL.md"]
  },
  "verificationSteps": [
    {
      "description": "Confirm every created file exists after Apply.",
      "kind": "filesystem"
    }
  ]
}
